[
  {
    "gap_id": "b887fd39-3f4e-49fa-addd-c48467308d3c",
    "gap_statement": "There are unresolved claim differences across papers under related tasks, suggesting a need for clearer comparison criteria.",
    "gap_type": "comparison",
    "supporting_evidence": [
      "contradiction_count=1",
      "cross_paper_task_groups=1"
    ],
    "counter_evidence": [],
    "confidence": 0.8,
    "novelty_value": 0.7,
    "review_worthiness": 0.76,
    "status": "verified"
  }
]